{
  "schema_version": "1",
  "batch_id": "m5-3-calibration-20260907",
  "inventory_id": "m5-core-5k",
  "inventory_revision": "m5-1",
  "generator": {
    "model_id": "human-editorial-calibration",
    "tool_version": "typewriter-m5-3-authoring-1",
    "prompt_version": "m5-3-calibration-v1",
    "draft_sha256": "8ba163ed1128b61abd438819ae36119530e22347c84915980cfcdc966af0d367"
  },
  "generated_at": "2026-09-07T08:29:02Z",
  "review": {
    "status": "complete",
    "reviewer": "typewriter-editorial-calibration",
    "completed_at": "2026-09-07T08:39:05Z"
  },
  "records": [
    {
      "source": "inventory",
      "inventory_id": "m5-001",
      "role": "start",
      "decision": "included",
      "decision_note": "Calibration review에서 모든 sense와 relation을 확인한 뒤 초안과 같은 editorial 결정을 포함했다.",
      "canonical_id": "w301"
    },
    {
      "source": "inventory",
      "inventory_id": "m5-002",
      "role": "start",
      "decision": "corrected",
      "decision_note": "Calibration review에서 senses·relations를 전수 교정한 뒤 포함했다.",
      "canonical_id": "w302",
      "corrected_fields": [
        "senses",
        "relations"
      ]
    },
    {
      "source": "inventory",
      "inventory_id": "m5-003",
      "role": "start",
      "decision": "corrected",
      "decision_note": "Calibration review에서 senses·relations를 전수 교정한 뒤 포함했다.",
      "canonical_id": "w303",
      "corrected_fields": [
        "senses",
        "relations"
      ]
    },
    {
      "source": "inventory",
      "inventory_id": "m5-004",
      "role": "start",
      "decision": "held",
      "decision_note": "Calibration review에서 sense 경계 또는 표현 단위의 기준을 먼저 보완해야 하므로 이번 import에서 보류했다."
    },
    {
      "source": "inventory",
      "inventory_id": "m5-005",
      "role": "start",
      "decision": "corrected",
      "decision_note": "Calibration review에서 senses·relations를 전수 교정한 뒤 포함했다.",
      "canonical_id": "w304",
      "corrected_fields": [
        "senses",
        "relations"
      ]
    },
    {
      "source": "inventory",
      "inventory_id": "m5-006",
      "role": "start",
      "decision": "included",
      "decision_note": "Calibration review에서 모든 sense와 relation을 확인한 뒤 초안과 같은 editorial 결정을 포함했다.",
      "canonical_id": "w305"
    },
    {
      "source": "inventory",
      "inventory_id": "m5-007",
      "role": "start",
      "decision": "corrected",
      "decision_note": "Calibration review에서 senses·relations를 전수 교정한 뒤 포함했다.",
      "canonical_id": "w306",
      "corrected_fields": [
        "senses",
        "relations"
      ]
    },
    {
      "source": "inventory",
      "inventory_id": "m5-008",
      "role": "start",
      "decision": "corrected",
      "decision_note": "Calibration review에서 senses·relations를 전수 교정한 뒤 포함했다.",
      "canonical_id": "w307",
      "corrected_fields": [
        "senses",
        "relations"
      ]
    },
    {
      "source": "inventory",
      "inventory_id": "m5-009",
      "role": "start",
      "decision": "corrected",
      "decision_note": "Calibration review에서 senses·relations를 전수 교정한 뒤 포함했다.",
      "canonical_id": "w308",
      "corrected_fields": [
        "senses",
        "relations"
      ]
    },
    {
      "source": "inventory",
      "inventory_id": "m5-010",
      "role": "start",
      "decision": "included",
      "decision_note": "Calibration review에서 모든 sense와 relation을 확인한 뒤 초안과 같은 editorial 결정을 포함했다.",
      "canonical_id": "w309"
    },
    {
      "source": "inventory",
      "inventory_id": "m5-011",
      "role": "start",
      "decision": "corrected",
      "decision_note": "Calibration review에서 senses를 전수 교정한 뒤 포함했다.",
      "canonical_id": "w310",
      "corrected_fields": [
        "senses"
      ]
    },
    {
      "source": "inventory",
      "inventory_id": "m5-012",
      "role": "start",
      "decision": "included",
      "decision_note": "Calibration review에서 모든 sense와 relation을 확인한 뒤 초안과 같은 editorial 결정을 포함했다.",
      "canonical_id": "w311"
    },
    {
      "source": "inventory",
      "inventory_id": "m5-013",
      "role": "start",
      "decision": "corrected",
      "decision_note": "Calibration review에서 relations를 전수 교정한 뒤 포함했다.",
      "canonical_id": "w312",
      "corrected_fields": [
        "relations"
      ]
    },
    {
      "source": "inventory",
      "inventory_id": "m5-014",
      "role": "start",
      "decision": "included",
      "decision_note": "Calibration review에서 모든 sense와 relation을 확인한 뒤 초안과 같은 editorial 결정을 포함했다.",
      "canonical_id": "w313"
    },
    {
      "source": "inventory",
      "inventory_id": "m5-015",
      "role": "start",
      "decision": "included",
      "decision_note": "Calibration review에서 모든 sense와 relation을 확인한 뒤 초안과 같은 editorial 결정을 포함했다.",
      "canonical_id": "w314"
    },
    {
      "source": "inventory",
      "inventory_id": "m5-016",
      "role": "start",
      "decision": "corrected",
      "decision_note": "Calibration review에서 senses·relations를 전수 교정한 뒤 포함했다.",
      "canonical_id": "w315",
      "corrected_fields": [
        "senses",
        "relations"
      ]
    },
    {
      "source": "inventory",
      "inventory_id": "m5-017",
      "role": "start",
      "decision": "corrected",
      "decision_note": "Calibration review에서 senses·relations를 전수 교정한 뒤 포함했다.",
      "canonical_id": "w316",
      "corrected_fields": [
        "senses",
        "relations"
      ]
    },
    {
      "source": "inventory",
      "inventory_id": "m5-018",
      "role": "start",
      "decision": "included",
      "decision_note": "Calibration review에서 모든 sense와 relation을 확인한 뒤 초안과 같은 editorial 결정을 포함했다.",
      "canonical_id": "w317"
    },
    {
      "source": "inventory",
      "inventory_id": "m5-019",
      "role": "start",
      "decision": "rejected",
      "decision_note": "Calibration review에서 현재 pilot의 writer-facing 검색 장면이 충분히 분리되지 않아 다음 선정 기준 보완 대상으로 반려했다."
    },
    {
      "source": "inventory",
      "inventory_id": "m5-020",
      "role": "start",
      "decision": "corrected",
      "decision_note": "Calibration review에서 senses·relations를 전수 교정한 뒤 포함했다.",
      "canonical_id": "w318",
      "corrected_fields": [
        "senses",
        "relations"
      ]
    },
    {
      "source": "inventory",
      "inventory_id": "m5-021",
      "role": "start",
      "decision": "included",
      "decision_note": "Calibration review에서 모든 sense와 relation을 확인한 뒤 초안과 같은 editorial 결정을 포함했다.",
      "canonical_id": "w319"
    },
    {
      "source": "inventory",
      "inventory_id": "m5-022",
      "role": "start",
      "decision": "included",
      "decision_note": "Calibration review에서 모든 sense와 relation을 확인한 뒤 초안과 같은 editorial 결정을 포함했다.",
      "canonical_id": "w320"
    },
    {
      "source": "inventory",
      "inventory_id": "m5-023",
      "role": "start",
      "decision": "corrected",
      "decision_note": "Calibration review에서 senses·relations를 전수 교정한 뒤 포함했다.",
      "canonical_id": "w321",
      "corrected_fields": [
        "senses",
        "relations"
      ]
    },
    {
      "source": "inventory",
      "inventory_id": "m5-024",
      "role": "start",
      "decision": "held",
      "decision_note": "Calibration review에서 sense 경계 또는 표현 단위의 기준을 먼저 보완해야 하므로 이번 import에서 보류했다."
    },
    {
      "source": "inventory",
      "inventory_id": "m5-025",
      "role": "start",
      "decision": "included",
      "decision_note": "Calibration review에서 모든 sense와 relation을 확인한 뒤 초안과 같은 editorial 결정을 포함했다.",
      "canonical_id": "w322"
    },
    {
      "source": "inventory",
      "inventory_id": "m5-026",
      "role": "start",
      "decision": "included",
      "decision_note": "Calibration review에서 모든 sense와 relation을 확인한 뒤 초안과 같은 editorial 결정을 포함했다.",
      "canonical_id": "w323"
    },
    {
      "source": "inventory",
      "inventory_id": "m5-027",
      "role": "start",
      "decision": "included",
      "decision_note": "Calibration review에서 모든 sense와 relation을 확인한 뒤 초안과 같은 editorial 결정을 포함했다.",
      "canonical_id": "w324"
    },
    {
      "source": "inventory",
      "inventory_id": "m5-028",
      "role": "start",
      "decision": "corrected",
      "decision_note": "Calibration review에서 senses·relations를 전수 교정한 뒤 포함했다.",
      "canonical_id": "w325",
      "corrected_fields": [
        "senses",
        "relations"
      ]
    },
    {
      "source": "inventory",
      "inventory_id": "m5-029",
      "role": "start",
      "decision": "corrected",
      "decision_note": "Calibration review에서 senses·relations를 전수 교정한 뒤 포함했다.",
      "canonical_id": "w326",
      "corrected_fields": [
        "senses",
        "relations"
      ]
    },
    {
      "source": "inventory",
      "inventory_id": "m5-030",
      "role": "start",
      "decision": "included",
      "decision_note": "Calibration review에서 모든 sense와 relation을 확인한 뒤 초안과 같은 editorial 결정을 포함했다.",
      "canonical_id": "w327"
    },
    {
      "source": "inventory",
      "inventory_id": "m5-031",
      "role": "start",
      "decision": "corrected",
      "decision_note": "Calibration review에서 senses·relations를 전수 교정한 뒤 포함했다.",
      "canonical_id": "w328",
      "corrected_fields": [
        "senses",
        "relations"
      ]
    },
    {
      "source": "inventory",
      "inventory_id": "m5-032",
      "role": "start",
      "decision": "corrected",
      "decision_note": "Calibration review에서 senses를 전수 교정한 뒤 포함했다.",
      "canonical_id": "w329",
      "corrected_fields": [
        "senses"
      ]
    },
    {
      "source": "inventory",
      "inventory_id": "m5-033",
      "role": "start",
      "decision": "included",
      "decision_note": "Calibration review에서 모든 sense와 relation을 확인한 뒤 초안과 같은 editorial 결정을 포함했다.",
      "canonical_id": "w330"
    },
    {
      "source": "inventory",
      "inventory_id": "m5-034",
      "role": "start",
      "decision": "rejected",
      "decision_note": "Calibration review에서 현재 pilot의 writer-facing 검색 장면이 충분히 분리되지 않아 다음 선정 기준 보완 대상으로 반려했다."
    },
    {